{
  "ran": true,
  "command": ".venv310/bin/python -m pytest tests/ -q",
  "python": ".venv310/bin/python",
  "python_version": "3.10.20",
  "clone_path": "/var/folders/b1/3h6gwh9j52zfp1sqxpkr5_680000gn/T/l5-clean-clone-givb8qdf/clone",
  "exit_code": 0,
  "output_tail": "........................................................................ [  4%]\n........................................................................ [  9%]\n........................................................................ [ 14%]\n........................................................................ [ 19%]\n........................................................................ [ 24%]\n........................................................................ [ 29%]\n........................................................................ [ 33%]\n........................................................................ [ 38%]\n........................................................................ [ 43%]\n........................................................................ [ 48%]\n........................................................................ [ 53%]\n........................................................................ [ 58%]\n........................................................................ [ 62%]\n........................................................................ [ 67%]\n........................................................................ [ 72%]\n........................................................................ [ 77%]\n........................................................................ [ 82%]\n........................................................................ [ 87%]\n........................................................................ [ 91%]\n........................................................................ [ 96%]\n.................................................                        [100%]\n1489 passed in 313.11s (0:05:13)\n"
}
